{
  "apiVersion": "noemaforge/v1",
  "kind": "SelfTestCaseCatalog",
  "version": "0.32.2",
  "invariant": {
    "llm_mode": "switchable",
    "max_active_llms": 1,
    "heavy_llm_autostart": false
  },
  "suites": {
    "core": [
      "cli_status_json",
      "pipeline_validate",
      "schema_validate",
      "persona_validate",
      "pipeline_metrics_prometheus",
      "toolproxy_offline_smoke",
      "dashboard_state",
      "code_qa_team_select",
      "code_qa_run_offline",
      "gui_helper_help_surface"
    ],
    "pipeline": [
      "pipeline_run_public_mwp",
      "pipeline_template_import"
    ],
    "media_adapters": [
      "media_adapter_telemetry_camera_mask_bridge",
      "media_adapter_telemetry_image_analysis",
      "media_adapter_telemetry_music_generation",
      "media_adapter_telemetry_photo_generation",
      "media_adapter_telemetry_video_generation",
      "media_adapter_telemetry_voice_generation"
    ],
    "full_safe": [
      "cli_status_json",
      "pipeline_validate",
      "schema_validate",
      "persona_validate",
      "pipeline_metrics_prometheus",
      "toolproxy_offline_smoke",
      "dashboard_state",
      "pipeline_run_public_mwp",
      "pipeline_template_import",
      "mvp_smoke_offline",
      "code_qa_team_select",
      "code_qa_run_offline",
      "gui_helper_help_surface"
    ],
    "module_compile": [
      "module_compile_src_administrator",
      "module_compile_src_audit_remediation",
      "module_compile_src_bootdoctor",
      "module_compile_src_brainctl",
      "module_compile_src_noemaforge_chat",
      "module_compile_src_noemaforge_core",
      "module_compile_src_noemaforge_eval",
      "module_compile_src_noemaforge_interpret",
      "module_compile_src_noemaforge_json_tools",
      "module_compile_src_noemaforge_llm_client",
      "module_compile_src_noemaforge_monitor",
      "module_compile_src_noemaforge_status",
      "module_compile_src_noemaforge_tasks",
      "module_compile_src_noemaforge_toolproxy_diag",
      "module_compile_src_brainui",
      "module_compile_src_bundles",
      "module_compile_src_canary_runner",
      "module_compile_src_caps",
      "module_compile_src_casebase",
      "module_compile_src_coordinator_fanout",
      "module_compile_src_daily_scheduler",
      "module_compile_src_daily_stats",
      "module_compile_src_dataset_inventory",
      "module_compile_src_discord_bridge",
      "module_compile_src_doctor",
      "module_compile_src_dream_cycle",
      "module_compile_src_email_airlock",
      "module_compile_src_embeddings",
      "module_compile_src_epoch",
      "module_compile_src_first_run_wizard",
      "module_compile_src_firstboot_eval",
      "module_compile_src_firstboot_orchestrator",
      "module_compile_src_firstboot_status",
      "module_compile_src_fixture_autogen",
      "module_compile_src_fixture_bundle",
      "module_compile_src_flow_catalog",
      "module_compile_src_flow_metrics",
      "module_compile_src_gguf_select",
      "module_compile_src_glove_agent",
      "module_compile_src_glove_runner",
      "module_compile_src_honeykeys",
      "module_compile_src_hwscan",
      "module_compile_src_ics_import",
      "module_compile_src_incident_metrics",
      "module_compile_src_incidents",
      "module_compile_src_installer_plan",
      "module_compile_src_invites",
      "module_compile_src_knowledge___init__",
      "module_compile_src_knowledge_conflict_runtime",
      "module_compile_src_knowledge_embedding_worker",
      "module_compile_src_knowledge_error_learning",
      "module_compile_src_knowledge_eval_runtime",
      "module_compile_src_knowledge_extraction_pipeline",
      "module_compile_src_knowledge_gatekeeper",
      "module_compile_src_knowledge_grounded_administrator",
      "module_compile_src_knowledge_ingest",
      "module_compile_src_knowledge_policy",
      "module_compile_src_knowledge_prep_pipeline",
      "module_compile_src_knowledge_prep_store",
      "module_compile_src_knowledge_retrieval",
      "module_compile_src_knowledge_store",
      "module_compile_src_knowledge_synthetic_book",
      "module_compile_src_knowledge_trails",
      "module_compile_src_knowledge_vector_index",
      "module_compile_src_knowledge_maintainer",
      "module_compile_src_lan_discovery",
      "module_compile_src_lan_identity",
      "module_compile_src_llm_backends_manager",
      "module_compile_src_localgateway",
      "module_compile_src_localgw_connectors___init__",
      "module_compile_src_localgw_connectors_base",
      "module_compile_src_localgw_connectors_ipp",
      "module_compile_src_localgw_connectors_octoprint",
      "module_compile_src_localgw_ratelimit",
      "module_compile_src_localgw_secrets",
      "module_compile_src_localgw_uplink",
      "module_compile_src_localgw_uplink_agent",
      "module_compile_src_lsm",
      "module_compile_src_lsp_facade",
      "module_compile_src_maintenance",
      "module_compile_src_mcp_router",
      "module_compile_src_memory_system",
      "module_compile_src_memsentinel",
      "module_compile_src_metrics_snapshot",
      "module_compile_src_model_capabilities",
      "module_compile_src_model_installer_plan",
      "module_compile_src_model_inventory_normalize",
      "module_compile_src_model_profiles",
      "module_compile_src_model_registry",
      "module_compile_src_model_router",
      "module_compile_src_model_scorecards",
      "module_compile_src_netguard",
      "module_compile_src_nids_lite",
      "module_compile_src_notifier",
      "module_compile_src_observability_metrics",
      "module_compile_src_offline_apt",
      "module_compile_src_persona_runtime",
      "module_compile_src_pi_firewall",
      "module_compile_src_pipeline_runtime",
      "module_compile_src_pipelines___init__",
      "module_compile_src_pipelines_finance_budget",
      "module_compile_src_pipelines_photos_diary",
      "module_compile_src_plan_mode",
      "module_compile_src_planned_sweep",
      "module_compile_src_plugin_runner",
      "module_compile_src_prestart",
      "module_compile_src_profile_manager",
      "module_compile_src_project_snapshot",
      "module_compile_src_quarantine",
      "module_compile_src_quarantine_samples",
      "module_compile_src_readinglist_workflow",
      "module_compile_src_resource_policy",
      "module_compile_src_resource_recovery",
      "module_compile_src_roadmap",
      "module_compile_src_role_runner",
      "module_compile_src_role_tournament",
      "module_compile_src_roles_role_entry",
      "module_compile_src_rss_airlock",
      "module_compile_src_runtime_safety",
      "module_compile_src_runtime_state",
      "module_compile_src_sandbox",
      "module_compile_src_scary_sweep",
      "module_compile_src_seclog",
      "module_compile_src_selfdev_learning",
      "module_compile_src_selftest_runtime",
      "module_compile_src_session_memory_extractor",
      "module_compile_src_skills_registry",
      "module_compile_src_sr_cycle",
      "module_compile_src_sr_lite",
      "module_compile_src_ssr_cycle",
      "module_compile_src_storage_broker",
      "module_compile_src_surgeon_auto",
      "module_compile_src_task_runner",
      "module_compile_src_task_tools",
      "module_compile_src_taskqueue",
      "module_compile_src_team_installer_plan",
      "module_compile_src_team_memory_sync",
      "module_compile_src_team_scorecards",
      "module_compile_src_team_search",
      "module_compile_src_telemetry",
      "module_compile_src_tg_bot_runtime",
      "module_compile_src_tg_channel_workflow",
      "module_compile_src_tool_onboard",
      "module_compile_src_toolproxy",
      "module_compile_src_toolvault",
      "module_compile_src_tts_runtime",
      "module_compile_src_ui_snapshot",
      "module_compile_src_vault_inventory",
      "module_compile_src_vault_reorg",
      "module_compile_src_verifiers",
      "module_compile_src_voice_ingest",
      "module_compile_src_vstore",
      "module_compile_src_webgateway",
      "module_compile_src_wiki_patch_runtime",
      "module_compile_src_worktree_manager"
    ],
    "all_safe": [
      "cli_status_json",
      "pipeline_validate",
      "schema_validate",
      "persona_validate",
      "pipeline_metrics_prometheus",
      "toolproxy_offline_smoke",
      "dashboard_state",
      "pipeline_run_public_mwp",
      "pipeline_template_import",
      "mvp_smoke_offline",
      "module_compile_src_administrator",
      "module_compile_src_audit_remediation",
      "module_compile_src_bootdoctor",
      "module_compile_src_brainctl",
      "module_compile_src_noemaforge_chat",
      "module_compile_src_noemaforge_core",
      "module_compile_src_noemaforge_eval",
      "module_compile_src_noemaforge_interpret",
      "module_compile_src_noemaforge_json_tools",
      "module_compile_src_noemaforge_llm_client",
      "module_compile_src_noemaforge_monitor",
      "module_compile_src_noemaforge_status",
      "module_compile_src_noemaforge_tasks",
      "module_compile_src_noemaforge_toolproxy_diag",
      "module_compile_src_brainui",
      "module_compile_src_bundles",
      "module_compile_src_canary_runner",
      "module_compile_src_caps",
      "module_compile_src_casebase",
      "module_compile_src_coordinator_fanout",
      "module_compile_src_daily_scheduler",
      "module_compile_src_daily_stats",
      "module_compile_src_dataset_inventory",
      "module_compile_src_discord_bridge",
      "module_compile_src_doctor",
      "module_compile_src_dream_cycle",
      "module_compile_src_email_airlock",
      "module_compile_src_embeddings",
      "module_compile_src_epoch",
      "module_compile_src_first_run_wizard",
      "module_compile_src_firstboot_eval",
      "module_compile_src_firstboot_orchestrator",
      "module_compile_src_firstboot_status",
      "module_compile_src_fixture_autogen",
      "module_compile_src_fixture_bundle",
      "module_compile_src_flow_catalog",